{
  "schema_version": "1.0.0",
  "assessment_id": "assessment_synthetic_example_v1",
  "candidate_id": "repro_12345678-1234-5678-9234-567812345678",
  "visibility": "curator_only",
  "rubric_version": "repro-score-1.0",
  "status": "final",
  "block_reason_codes": [],
  "report_artifact_ids": [
    "artifact_private_report"
  ],
  "findings": [
    {
      "finding_id": "table_1",
      "type": "table",
      "paper_label": "Table 1",
      "verbatim_claim": null,
      "paper_locator": {
        "artifact_id": "artifact_paper_pdf",
        "page": 4,
        "section": "Results",
        "label": "Table 1",
        "quote": null
      },
      "report_locators": [
        {
          "artifact_id": "artifact_private_report",
          "page": 2,
          "section": "Reproduced results",
          "label": "Table A",
          "quote": "Table 1 was reproduced."
        }
      ],
      "producing_scripts": [
        "analysis/main.R"
      ],
      "required_inputs": [
        "data/input.csv"
      ],
      "expected_outputs": [
        "output/table1.csv"
      ],
      "comparison": {
        "method": "table",
        "procedure": "Compare all displayed cells after applying the paper's stated rounding.",
        "tolerance": "Absolute numeric difference no greater than 0.001 before display rounding.",
        "expected_output_artifact_ids": [
          "artifact_expected_table_1"
        ]
      },
      "outcome": "consistent",
      "issue_locus": "none",
      "severity": "none",
      "review_status": "double_annotated_agree",
      "notes": "Synthetic finding used only for schema validation."
    }
  ],
  "paper_score": 4,
  "score_reason": "All synthetic target findings are consistent.",
  "scientific_outcome": "fully_reproducible",
  "execution_outcome": "success",
  "task_packaging_outcome": "pass",
  "execution_attempt_ids": [
    "execution_clean_001",
    "execution_clean_002"
  ],
  "independent_reviews": [
    {
      "review_id": "review_synthetic_001",
      "reviewer_id": "curator_001",
      "round": 1,
      "blind_to_other_reviews": true,
      "finding_decisions": [
        {
          "finding_id": "table_1",
          "outcome": "consistent",
          "note": null
        }
      ],
      "proposed_score": 4,
      "submitted_at": "2026-08-21T14:00:00Z",
      "note": null
    },
    {
      "review_id": "review_synthetic_002",
      "reviewer_id": "curator_002",
      "round": 1,
      "blind_to_other_reviews": true,
      "finding_decisions": [
        {
          "finding_id": "table_1",
          "outcome": "consistent",
          "note": null
        }
      ],
      "proposed_score": 4,
      "submitted_at": "2026-08-21T14:05:00Z",
      "note": null
    }
  ],
  "adjudication": null,
  "created_at": "2026-08-21T13:30:00Z",
  "updated_at": "2026-08-21T14:05:00Z"
}
